"Wahlkreis","Wahlkreis_fr","Storyboard","Text_de","Text_fr","Sitze_all","text_wahlkreis_de","text_wahlkreis_fr","Color"
"Berner Jura","Jura bernois","G_mehrereParteien;L_zweiParteien_2Sitze_1Sitz;Sitzverteilung;Sitzverteilung_Zusatz_Diverse_mehrereSitze;Neu_gewaehlt_mehrere;Abgewaehlt_mehrere;","Im Wahlkreis Jura bernois gibt es mehrere Gewinner: Die <b>EDU</b> holt zwei Sitze, die <b>EVP</b> holt zwei Sitze, die <b>Mitte</b> holt zwei Sitze und die <b>GLP</b> holt einen Sitz.<br><br>Die <b>SVP</b> und die <b>FDP</b> sind die Verlierer. Sie büssen zwei und einen Sitz ein.<br><br>Neu hält die EVP drei Sitze, die EDU zwei Sitze, die Mitte zwei Sitze, die SP zwei Sitze, die SVP zwei Sitze, die GLP einen Sitz, die Grünen einen Sitz und die FDP einen Sitz.<br><br>Für eine Überraschung sorgt die Liste Ensemble socialiste, die  zwei Sitze erobern kann.<br><br>In diesem Wahlkreis neu gewählt wurden Heyer Virginie (EVP), Riesen Maurane (SP), Roulet Romy Sandra (FDP) und Niederhauser Jean-Luc (EVP).<br><br>Abgewählt sind Ruchonnet Michel (SVP), Sauvain Pierre (SP) und Robbiani Patrizio (SP).","Plusieurs partis sont vainqueurs dans le cercle électoral du Jura bernois: le <b>UDF</b> obtient deux sièges, le <b>PEV</b> obtient deux sièges, le <b>Centre</b> obtient deux sièges et les <b>Vert'libéraux</b> obtiennent un siège<br><br><b>L'UDC</b> et le <b>PLR</b> ont connu un dimanche difficile: ils perdent respectivement deux et un siège.<br><br>Le PEV détient désormais trois sièges, le UDF deux sièges, le Centre deux sièges, le PS deux sièges, l'UDC deux sièges, les Vert'libéraux un siège, les Verts un siège et le PLR un siège.<br><br>Un tout petit parti issu d'Ensemble socialiste parvient à faire élire plusieurs candidats.<br><br>Heyer Virginie (PEV), Riesen Maurane (PS), Roulet Romy Sandra (PLR) et Niederhauser Jean-Luc (PEV) siégeront pour la première fois au Grand Conseil.<br><br>Les électeurs ont montré la porte à Ruchonnet Michel (UDC), Sauvain Pierre (PS) et Robbiani Patrizio (PS)","12","Wahlkreis Berner Jura (12 Sitze)","Cercle électoral du Jura bernois (12 sièges)",1
"Biel-Seeland","Bienne-Seeland","G_mehrereParteien;LL_zweiParteien;Sitzverteilung;Sitzverteilung_Zusatz_Diverse_mehrere;Sitzverteilung_Zusatz_Aufrecht_mehrereSitze;Neu_gewaehlt_mehrere;Abgewaehlt_mehrere;","Im Wahlkreis Biel-Bienne - Seeland gibt es mehrere Gewinner: Die <b>EVP</b> holt zwei Sitze, die <b>FDP</b> holt zwei Sitze, die <b>EDU</b> holt einen Sitz und die <b>Grünen</b> holen einen Sitz.<br><br>Die <b>SP</b> und die <b>SVP</b> sind die grossen Verlierer. Sie büssen sechs und fünf Sitze ein.<br><br>Neu hält die FDP sechs Sitze, die EVP drei Sitze, die Grünen drei Sitze, die GLP zwei Sitze, die Mitte zwei Sitze, die SVP zwei Sitze, die EDU einen Sitz und die SP einen Sitz.<br><br>Gleich mehrere weitere Listen erobern sich Sitze: Die Liste 'Schweizer Demokraten' holt einen Sitz und die Liste 'Partei der Arbeit' holt einen Sitz.<br><br>Die politische Bewegung ""Aufrecht Schweiz"", die von Covid-Massnahmengegnern gegründet wurde, erobert sich gleich auf Anhieb zwei Sitze.<br><br>In diesem Wahlkreis neu gewählt wurden Kocher Hirt Manuela (SP), Hegg Andreas (FDP), Bütikofer Stefan (SP), Gerber Peter (Mitte), Hess Sandra (FDP), Schneider Sandra (SP), Stucki Barbara (Aufrecht Schweiz) und Stocker Julien (Grüne).<br><br>Abgewählt sind Rudin Michel (Aufrecht Schweiz), Messerli Philippe (SVP) und Güntensperger Nathan (Grüne).","Plusieurs partis sont vainqueurs dans le cercle électoral de Bienne-Seeland: le <b>PEV</b> obtient deux sièges, le <b>PLR</b> obtient deux sièges, le <b>UDF</b> obtient un siège et les <b>Verts</b> obtiennent un siège<br><br>Le <b>PS</b> et <b>l'UDC</b> sont les grands battus. Ils perdent respectivement six et cinq sièges.<br><br>Le PLR détient désormais six sièges, le PEV trois sièges, les Verts trois sièges, les Vert'libéraux deux sièges, le Centre deux sièges, l'UDC deux sièges, le UDF un siège et le PS un siège.<br><br>Plusieurs nouveaux élus sont membres de très petits partis: la liste 'Schweizer Demokraten' obtient un siège et la liste 'Partei der Arbeit' obtient un siège.<br><br>NA<br><br>Kocher Hirt Manuela (PS), Hegg Andreas (PLR), Bütikofer Stefan (PS), Gerber Peter (Centre), Hess Sandra (PLR), Schneider Sandra (PS), Stucki Barbara (Debout la Suisse) et Stocker Julien (Verts) siégeront pour la première fois au Grand Conseil.<br><br>Les électeurs ont montré la porte à Rudin Michel (Debout la Suisse), Messerli Philippe (UDC) et Güntensperger Nathan (Verts)","27","Wahlkreis Biel-Seeland (27 Sitze)","Cercle électoral de Bienne-Seeland (27 sièges)",2
"Oberaargau","Haute-Argovie","G_mehrereParteien;L_zweiParteien_2Sitze_1Sitz;Sitzverteilung;Sitzverteilung_Zusatz_Diverse_mehrere;Neu_gewaehlt_mehrere;","Im Wahlkreis Oberaargau gibt es mehrere Gewinner: Die <b>GLP</b> holt zwei Sitze, die <b>EVP</b> holt einen Sitz und die <b>Mitte</b> holt einen Sitz.<br><br>Die <b>SVP</b> und die <b>FDP</b> sind die Verlierer. Sie büssen zwei und einen Sitz ein.<br><br>Neu hält die SP drei Sitze, die GLP zwei Sitze, die EVP zwei Sitze, die Mitte zwei Sitze, die SVP zwei Sitze, die EDU einen Sitz und die FDP einen Sitz.<br><br>Gleich mehrere weitere Listen erobern sich Sitze: Die Liste 'Unabhängige Liste Oberaargau' holt zwei Sitze und die Liste 'Die Musketiere' holt zwei Sitze.<br><br>In diesem Wahlkreis neu gewählt wurden Bösiger Beat (SP) und Schüpbach Andreas (SP).","Plusieurs partis sont vainqueurs dans le cercle électoral de la Haute-Argovie: les <b>Vert'libéraux</b> obtiennent deux sièges, le <b>PEV</b> obtient un siège et le <b>Centre</b> obtient un siège<br><br><b>L'UDC</b> et le <b>PLR</b> ont connu un dimanche difficile: ils perdent respectivement deux et un siège.<br><br>Le PS détient désormais trois sièges, les Vert'libéraux deux sièges, le PEV deux sièges, le Centre deux sièges, l'UDC deux sièges, le UDF un siège et le PLR un siège.<br><br>Plusieurs nouveaux élus sont membres de très petits partis: la liste 'Unabhängige Liste Oberaargau' obtient deux sièges et la liste 'Die Musketiere' obtient deux sièges.<br><br>Bösiger Beat (PS) et Schüpbach Andreas (PS) siégeront pour la première fois au Grand Conseil.","12","Wahlkreis Oberaargau (12 Sitze)","Cercle électoral de la Haute-Argovie (12 sièges)",3
"Emmental","Emmental","GG_einePartei;LL_einePartei;Sitzverteilung;Sitzverteilung_Zusatz_alle_Sitze_weg_mehrere;Neu_gewaehlt_mehrere;","Die <b>SP</b> ist im Wahlkreis Emmental die grosse Gewinnerin. Sie holt drei Sitze.<br><br>Die <b>SVP</b> ist die grosse Verliererin. Sie büsst sechs Sitze ein.<br><br>Neu hält die SP fünf Sitze, die EVP drei Sitze, die Mitte drei Sitze, die FDP zwei Sitze, die GLP zwei Sitze und die Grünen einen Sitz.<br><br>Die EDU und die SVP halten keine Sitze mehr.<br><br>In diesem Wahlkreis neu gewählt wurden Gfeller Ueli (FDP), Buri Urs (EDU) und Rappa Francesco Marco (SVP).","Le <b>PS</b> est le grand gagnant du cercle électoral de l’Emmental. Il remporte trois sièges.<br><br><b>L'UDC</b> est le grand battu. Il perd six sièges.<br><br>Le PS détient désormais cinq sièges, le PEV trois sièges, le Centre trois sièges, le PLR deux sièges, les Vert'libéraux deux sièges et les Verts un siège.<br><br>Le UDF et l'UDC ont perdu tous leurs sièges.<br><br>Gfeller Ueli (PLR), Buri Urs (UDF) et Rappa Francesco Marco (UDC) siégeront pour la première fois au Grand Conseil.","15","Wahlkreis Emmental (15 Sitze)","Cercle électoral de l’Emmental (15 sièges)",4
"Mittelland-Nord","Mittelland septentrional","G_zweiParteien_2Sitze;LL_zweiParteien;Sitzverteilung;Neu_gewaehlt_mehrere;Abgewaehlt_mehrere;","Die <b>EVP</b> und die <b>GLP</b> sind im Wahlkreis Mittelland-Nord die Gewinner. Sie holen je zwei Sitze.<br><br>Die <b>SP</b> und die <b>SVP</b> sind die grossen Verlierer. Sie büssen fünf und vier Sitze ein.<br><br>Neu hält die GLP vier Sitze, die EVP drei Sitze, die FDP zwei Sitze, die SVP zwei Sitze, die Grünen einen Sitz, die Mitte einen Sitz und die SP einen Sitz.<br><br>In diesem Wahlkreis neu gewählt wurden Fisli Karin (Grüne), Baumgartner Lydia (Grüne), Schilt Walter (SVP), Salzmann Peter (SVP) und Arn Daniel (GLP).<br><br>Abgewählt sind Schwaar Daniel (Mitte) und Leiser Thomas (EVP).","Le <b>PEV</b> et les <b>Vert'libéraux</b> sont les gagnants du cercle électoral du Mittelland septentrional. Ils empochent chacun deux sièges.<br><br>Le <b>PS</b> et <b>l'UDC</b> sont les grands battus. Ils perdent respectivement cinq et quatre sièges.<br><br>Les Vert'libéraux détiennent désormais quatre sièges, le PEV trois sièges, le PLR deux sièges, l'UDC deux sièges, les Verts un siège, le Centre un siège et le PS un siège.<br><br>Fisli Karin (Verts), Baumgartner Lydia (Verts), Schilt Walter (UDC), Salzmann Peter (UDC) et Arn Daniel (Vert'libéraux) siégeront pour la première fois au Grand Conseil.<br><br>Les électeurs ont montré la porte à Schwaar Daniel (Centre) et Leiser Thomas (PEV)","22","Wahlkreis Mittelland-Nord (22 Sitze)","Cercle électoral du Mittelland septentrional (22 sièges)",5
"Bern","Berne","G_zweiParteien_1Sitz;LL_einePartei;Sitzverteilung;Sitzverteilung_Zusatz_alle_Sitze_weg;Sitzverteilung_Zusatz_Diverse_mehrere;Sitzverzeilung_Zusatz_Aufrecht_1Sitz;Neu_gewaehlt_mehrere;Abgewaehlt_mehrere;","Die <b>EVP</b> und die <b>FDP</b> sind im Wahlkreis Bern die Gewinner. Sie holen je einen Sitz.<br><br>Die <b>SP</b> ist die grosse Verliererin. Sie büsst vier Sitze ein.<br><br>Neu hält die FDP drei Sitze, die Grünen drei Sitze, die SP drei Sitze, die EVP zwei Sitze, die GLP zwei Sitze und die SVP zwei Sitze.<br><br>Die Mitte hält keine Sitze mehr.<br><br>Gleich mehrere weitere Listen erobern sich Sitze: Die Liste 'Alternative Linke Bern' holt einen Sitz und die Liste 'Demokratische Bewegung' holt einen Sitz.<br><br>Die politische Bewegung ""Aufrecht Schweiz"", die von Covid-Massnahmengegnern gegründet wurde, erobert sich gleich auf Anhieb einen Sitz.<br><br>In diesem Wahlkreis neu gewählt wurden Funiciello Tamara (GLP), Trede Aline (FDP), Hess Erich (FDP) und Ammann Christa (Grüne).<br><br>Abgewählt sind Klauser Daniel (FDP) und Machado Rebmann Simone (EDU).","Le <b>PEV</b> et le <b>PLR</b> sont les gagnants du cercle électoral de Berne. Ils empochent chacun un siège.<br><br>Le <b>PS</b> est le grand battu. Il perd quatre sièges.<br><br>Le PLR détient désormais trois sièges, les Verts trois sièges, le PS trois sièges, le PEV deux sièges, les Vert'libéraux deux sièges et l'UDC deux sièges.<br><br>Le Centre a perdu tous ses sièges.<br><br>Plusieurs nouveaux élus sont membres de très petits partis: la liste 'Alternative Linke Bern' obtient un siège et la liste 'Demokratische Bewegung' obtient un siège.<br><br>NA<br><br>Funiciello Tamara (Vert'libéraux), Tred'Aline (PLR), Hess Erich (PLR) et Ammann Christa (Verts) siégeront pour la première fois au Grand Conseil.<br><br>Les électeurs ont montré la porte à Klauser Daniel (PLR) et Machado Rebmann Simone (UDF)","20","Wahlkreis Bern (20 Sitze)","Cercle électoral de Berne (20 sièges)",6
"Mittelland-Süd","Mittelland méridional","G_einePartei_2Sitze;LL_zweiParteien_gleich;Sitzverteilung;Sitzverteilung_Zusatz_alle_Sitze_weg;Sitzverteilung_Zusatz_Aufrecht_mehrereSitze;Neu_gewaehlt_mehrere;Abgewaehlt_1Person;","Die <b>Grünen</b> sind im Wahlkreis Mittelland-Süd die Gewinner. Sie holen zwei Sitze.<br><br>Die <b>SVP</b> und die <b>SP</b> sind die grossen Verlierer. Sie büssen je vier Sitze ein.<br><br>Neu halten die Grünenn vier Sitze, die EDU einen Sitz, die EVP einen Sitz, die GLP einen Sitz, die Mitte einen Sitz, die SP einen Sitz und die SVP einen Sitz.<br><br>Die FDP hält keine Sitze mehr.<br><br>Die politische Bewegung ""Aufrecht Schweiz"", die von Covid-Massnahmengegnern gegründet wurde, erobert sich gleich auf Anhieb zwei Sitze.<br><br>In diesem Wahlkreis neu gewählt wurden Bauer Tanja (EVP) und Eichenberger Beatrice (GLP).<br><br>Abgewählt ist Burren Andreas (SP).","Les <b>Verts</b> sont les gagnants du cercle électoral du Mittelland méridional. Ils remportent deux sièges.<br><br><b>L'UDC</b> et le <b>PS</b> sont les grands battus. Ils perdent respectivement quatre et quatre sièges.<br><br>Les Verts détiennent désormais quatre sièges, le UDF un siège, le PEV un siège, les Vert'libéraux un siège, le Centre un siège, le PS un siège et l'UDC un siège.<br><br>Le PLR a perdu tous ses sièges.<br><br>NA<br><br>Bauer Tanja (PEV) et Eichenberger Beatrice (Vert'libéraux) siégeront pour la première fois au Grand Conseil.<br><br>Les électeurs ont montré la porte à Burren Andreas (PS)","20","Wahlkreis Mittelland-Süd (20 Sitze)","Cercle électoral du Mittelland méridional (20 sièges)",7
"Thun","Thoune","G_mehrereParteien;LL_einePartei;Sitzverteilung;Sitzverteilung_Zusatz_Diverse_1Sitz;Sitzverzeilung_Zusatz_Aufrecht_1Sitz;Neu_gewaehlt_1Person;","Im Wahlkreis Thun gibt es mehrere Gewinner: Die <b>EVP</b> holt einen Sitz, die <b>GLP</b> holt einen Sitz, die <b>Grünen</b> holen einen Sitz und die <b>Mitte</b> holt einen Sitz.<br><br>Die <b>SVP</b> ist die grosse Verliererin. Sie büsst drei Sitze ein.<br><br>Neu hält die SP vier Sitze, die EVP drei Sitze, die GLP zwei Sitze, die Grünen zwei Sitze, die Mitte zwei Sitze, die SVP zwei Sitze, die EDU einen Sitz und die FDP einen Sitz.<br><br>Für eine Überraschung sorgt die Liste Bürgerliche Stadt- und Landliste, die einen Sitz erobern kann.<br><br>Die politische Bewegung ""Aufrecht Schweiz"", die von Covid-Massnahmengegnern gegründet wurde, erobert sich gleich auf Anhieb einen Sitz.<br><br>In diesem Wahlkreis neu gewählt wurde Dütschler Peter (EVP).","Plusieurs partis sont vainqueurs dans le cercle électoral de Thoune: le <b>PEV</b> obtient un siège, les <b>Vert'libéraux</b> obtiennent un siège, les <b>Verts</b> obtiennent un siège et le <b>Centre</b> obtient un siège<br><br><b>L'UDC</b> est le grand battu. Il perd trois sièges.<br><br>Le PS détient désormais quatre sièges, le PEV trois sièges, les Vert'libéraux deux sièges, les Verts deux sièges, le Centre deux sièges, l'UDC deux sièges, le UDF un siège et le PLR un siège.<br><br>Un tout petit parti issu de Bürgerliche Stadt- und Landliste parvient à faire élire un candidat.<br><br>NA<br><br>Dütschler Peter (PEV) siégera pour la première fois au Grand Conseil.","16","Wahlkreis Thun (16 Sitze)","Cercle électoral de Thoune (16 sièges)",8
"Oberland","Oberland","GG_einePartei;L_mehrereParteien;Sitzverteilung;Sitzverteilung_Zusatz_alle_Sitze_weg_mehrere;Neu_gewaehlt_mehrere;","Die <b>EDU</b> ist im Wahlkreis Oberland die grosse Gewinnerin. Sie holt drei Sitze.<br><br>Es gibt mehrere Verlierer: Die <b>GLP</b> verliert einen Sitz, die <b>Grünen</b> verlieren einen Sitz und die <b>SVP</b> verliert einen Sitz.<br><br>Neu hält die SVP sechs Sitze, die EDU vier Sitze, die EVP zwei Sitze, die Mitte zwei Sitze, die FDP zwei Sitze und die SP zwei Sitze.<br><br>Die GLP und die Grünen halten keine Sitze mehr.<br><br>In diesem Wahlkreis neu gewählt wurden Josi Barbara (SVP), Zimmermann Kurt (SVP), Wandfluh Ernst (SVP), Michel Andreas (SVP) und Abplanalp Ueli (SVP).","Le <b>UDF</b> est le grand gagnant du cercle électoral de l’Oberland. Il remporte trois sièges.<br><br>Les résultats sont mauvais pour les <b>Vert'libéraux</b> qui perdent un siège, les <b>Verts</b> qui perdent un siège et <b>l'UDC</b> qui perd un siège.<br><br>L'UDC détient désormais six sièges, le UDF quatre sièges, le PEV deux sièges, le Centre deux sièges, le PLR deux sièges et le PS deux sièges.<br><br>Les Vert'libéraux et les Verts ont perdu tous leurs sièges.<br><br>Josi Barbara (UDC), Zimmermann Kurt (UDC), Wandfluh Ernst (UDC), Michel Andreas (UDC) et Abplanalp Ueli (UDC) siégeront pour la première fois au Grand Conseil.","16","Wahlkreis Oberland (16 Sitze)","Cercle électoral de l’Oberland (16 sièges)",9
