"Wahlkreis","Wahlkreis_fr","Storyboard","Text_de","Text_fr","Color"
"Berner Jura","Jura bernois","GG_einePartei;LL_einePartei;Sitzverteilung;Sitzverteilung_Zusatz_Diverse_1Sitz;Neu_gewaehlt_mehrere;Abgewaehlt_mehrere;","Die <b>EVP</b> ist im Wahlkreis Jura bernois die grosse Gewinnerin. Sie holt fünf zusätzliche Sitze.<br><br>Die <b>SVP</b> ist die grosse Verliererin. Sie büsst drei Sitze ein.<br><br>Neu hält die EVP sechs Sitze, die SP zwei Sitze, die EDU einen Sitz, die FDP einen Sitz und die SVP einen Sitz.<br><br>Für eine Überraschung sorgt die Liste Ensemble socialiste, die einen Sitz erobern kann.<br><br>In diesem Wahlkreis neu gewählt wurden Heyer Virginie (EVP), Riesen Maurane (SP), Roulet Romy Sandra (FDP) und Niederhauser Jean-Luc (EVP).<br><br>Abgewählt sind Ruchonnet Michel (SVP), Sauvain Pierre (SP) und Robbiani Patrizio (SP).","Le <b>PEV</b> est le grand gagnant de l'arrondissement Jura bernois. Il remporte cinq sièges supplémentaires.<br><br><b>L'UDC</b> est le grand battu. Il perd trois sièges.<br><br>Le PEV détient désormais six sièges, le PS deux sièges, le UDF un siège, le PLR un siège et l'UDC un siège.<br><br>Un tout petit parti issu des Ensemble socialiste parvient à faire élire un candidat.<br><br>Heyer Virginie (PEV), Riesen Maurane (PS), Roulet Romy Sandra (PLR) et Niederhauser Jean-Luc (PEV) siégeront pour la première fois au Grand Conseil.<br><br>Les électeurs ont montré la porte à Ruchonnet Michel (UDC), Sauvain Pierre (PS) et Robbiani Patrizio (PS)",1
"Biel-Seeland","Bienne-Seeland","GG_einePartei;LL_einePartei;Sitzverteilung;Sitzverteilung_Zusatz_alle_Sitze_weg_mehrere;Sitzverzeilung_Zusatz_Aufrecht_1Sitz;Neu_gewaehlt_mehrere;Abgewaehlt_mehrere;","Die <b>EDU</b> ist im Wahlkreis Biel-Bienne - Seeland die grosse Gewinnerin. Sie holt fünf zusätzliche Sitze.<br><br>Die <b>SVP</b> ist die grosse Verliererin. Sie büsst sechs Sitze ein.<br><br>Neu hält die SP neun Sitze, die EDU fünf Sitze, die FDP vier Sitze, die Mitte drei Sitze, die Grünen einen Sitz und die SVP einen Sitz.<br><br>Die EVP und die GLP halten keine Sitze mehr.<br><br>Die politische Bewegung ""Aufrecht Schweiz"", die von Covid-Massnahmengegnern gegründet wurde, erobert sich gleich auf Anhieb einen Sitz.<br><br>In diesem Wahlkreis neu gewählt wurden Kocher Hirt Manuela (SP), Hegg Andreas (FDP), Bütikofer Stefan (SP), Gerber Peter (Mitte), Hess Sandra (FDP), Schneider Sandra (SP), Stucki Barbara (Aufrecht Schweiz) und Stocker Julien (Grüne).<br><br>Abgewählt sind Rudin Michel (Aufrecht Schweiz), Messerli Philippe (SVP) und Güntensperger Nathan (Grüne).","Le <b>UDF</b> est le grand gagnant de l'arrondissement Bienne-Seeland. Il remporte cinq sièges supplémentaires.<br><br><b>L'UDC</b> est le grand battu. Il perd six sièges.<br><br>Le PS détient désormais neuf sièges, le UDF cinq sièges, le PLR quatre sièges, le Centre trois sièges, les Verts un siège et l'UDC un siège.<br><br>Le PEV et les Vert'libéraux ont perdu tous les leurs sièges.<br><br>NA<br><br>Kocher Hirt Manuela (PS), Hegg Andreas (PLR), Bütikofer Stefan (PS), Gerber Peter (Centre), Hess Sandra (PLR), Schneider Sandra (PS), Stucki Barbara (Debout la Suisse) et Stocker Julien (Verts) siégeront pour la première fois au Grand Conseil.<br><br>Les électeurs ont montré la porte à Rudin Michel (Debout la Suisse), Messerli Philippe (UDC) et Güntensperger Nathan (Verts)",2
"Oberaargau","Haute-Argovie","GG_einePartei;LL_einePartei;Sitzverteilung;Sitzverteilung_Zusatz_alle_Sitze_weg_mehrere;Neu_gewaehlt_mehrere;","Die <b>GLP</b> ist im Wahlkreis Oberaargau die grosse Gewinnerin. Sie holt drei zusätzliche Sitze.<br><br>Die <b>SVP</b> ist die grosse Verliererin. Sie büsst vier Sitze ein.<br><br>Neu hält die SP vier Sitze, die GLP drei Sitze, die EVP drei Sitze, die EDU einen Sitz und die FDP einen Sitz.<br><br>Die Mitte und die SVP halten keine Sitze mehr.<br><br>In diesem Wahlkreis neu gewählt wurden Bösiger Beat (SP) und Schüpbach Andreas (SP).","Les <b>Vert'libéraux</b> sont le grand gagnants de l'arrondissement Haute-Argovie. Il remportertent trois sièges supplémentaires.<br><br><b>L'UDC</b> est le grand battu. Il perd quatre sièges.<br><br>Le PS détient désormais quatre sièges, les Vert'libéraux trois sièges, le PEV trois sièges, le UDF un siège et le PLR un siège.<br><br>Le Centre et l'UDC ont perdu tous les leurs sièges.<br><br>Bösiger Beat (PS) et Schüpbach Andreas (PS) siégeront pour la première fois au Grand Conseil.",3
"Emmental","Emmental","GG_einePartei;LL_einePartei;Sitzverteilung;Neu_gewaehlt_mehrere;","Die <b>FDP</b> ist im Wahlkreis Emmental die grosse Gewinnerin. Sie holt drei zusätzliche Sitze.<br><br>Die <b>SVP</b> ist die grosse Verliererin. Sie büsst vier Sitze ein.<br><br>Neu hält die FDP vier Sitze, die EDU drei Sitze, die EVP zwei Sitze, die Mitte zwei Sitze, die SVP zwei Sitze, die GLP einen Sitz und die SP einen Sitz.<br><br>In diesem Wahlkreis neu gewählt wurden Gfeller Ueli (FDP), Buri Urs (EDU) und Rappa Francesco Marco (SVP).","Le <b>PLR</b> est le grand gagnant de l'arrondissement Emmental. Il remporte trois sièges supplémentaires.<br><br><b>L'UDC</b> est le grand battu. Il perd quatre sièges.<br><br>Le PLR détient désormais quatre sièges, le UDF trois sièges, le PEV deux sièges, le Centre deux sièges, l'UDC deux sièges, les Vert'libéraux un siège et le PS un siège.<br><br>Gfeller Ueli (PLR), Buri Urs (UDF) et Rappa Francesco Marco (UDC) siégeront pour la première fois au Grand Conseil.",4
"Mittelland-Nord","Mittelland septentrional","GG_einePartei;LL_zweiParteien_gleich;Sitzverteilung;Sitzverteilung_Zusatz_alle_Sitze_weg;Neu_gewaehlt_mehrere;Abgewaehlt_mehrere;","Die <b>Grünen</b> sind im Wahlkreis Mittelland-Nord die grossen Gewinner. Sie holen vier zusätzliche Sitze.<br><br>Die <b>SP</b> und die <b>FDP</b> sind die grossen Verlierer. Sie büssen je drei Sitze ein.<br><br>Neu halten die Grünen sechs Sitze, die SVP sechs Sitze, die GLP vier Sitze, die SP drei Sitze, die Mitte zwei Sitze und die EVP einen Sitz.<br><br>Die FDP hält keine Sitze mehr.<br><br>In diesem Wahlkreis neu gewählt wurden Fisli Karin (Grüne), Baumgartner Lydia (Grüne), Schilt Walter (SVP), Salzmann Peter (SVP) und Arn Daniel (GLP).<br><br>Abgewählt sind Schwaar Daniel (Mitte) und Leiser Thomas (EVP).","Les <b>Verts</b> sont le grand gagnants de l'arrondissement Mittelland septentrional. Il remportertent quatre sièges supplémentaires.<br><br>Le <b>PS</b> et le <b>PLR</b> sont les grands battus. Ils perdent respectivement trois 3 sièges.<br><br>Les Verts détient désormais six sièges, l'UDC six sièges, les Vert'libéraux quatre sièges, le PS trois sièges, le Centre deux sièges et le PEV un siège.<br><br>Le PLR a perdu tous ses sièges.<br><br>Fisli Karin (Verts), Baumgartner Lydia (Verts), Schilt Walter (UDC), Salzmann Peter (UDC) et Arn Daniel (Vert'libéraux) siégeront pour la première fois au Grand Conseil.<br><br>Les électeurs ont montré la porte à Schwaar Daniel (Centre) et Leiser Thomas (PEV)",5
"Bern","Berne","GG_zweiParteien_gleich;LL_einePartei;Sitzverteilung;Sitzverteilung_Zusatz_alle_Sitze_weg_mehrere;Neu_gewaehlt_mehrere;Abgewaehlt_mehrere;","Die <b>FDP</b> und die <b>GLP</b> sind im Wahlkreis Bern die grossen Gewinner. Sie holen je fünf zusätzliche Sitze.<br><br>Die <b>SP</b> ist die grosse Verliererin. Sie büsst sieben Sitze ein.<br><br>Neu hält die FDP sieben Sitze, die GLP sieben Sitze, die Grünen drei Sitze, die Mitte zwei Sitze und die SVP einen Sitz.<br><br>Die EVP und die SP halten keine Sitze mehr.<br><br>In diesem Wahlkreis neu gewählt wurden Funiciello Tamara (GLP), Trede Aline (FDP), Hess Erich (FDP) und Ammann Christa (Grüne).<br><br>Abgewählt sind Klauser Daniel (FDP) und Machado Rebmann Simone (EDU).","Le <b>PLR</b> et le ParteiSecond_fr sont les grands gagnants de l'arrondissement Berne. Il remportent chacun cinq sièges supplémentaires.<br><br>Le <b>PS</b> est le grand battu. Il perd sept sièges.<br><br>Le PLR détient désormais sept sièges, les Vert'libéraux sept sièges, les Verts trois sièges, le Centre deux sièges et l'UDC un siège.<br><br>Le PEV et le PS ont perdu tous les leurs sièges.<br><br>Funiciello Tamara (Vert'libéraux), Tred'Aline (PLR), Hess Erich (PLR) et Ammann Christa (Verts) siégeront pour la première fois au Grand Conseil.<br><br>Les électeurs ont montré la porte à Klauser Daniel (PLR) et Machado Rebmann Simone (UDF)",6
"Mittelland-Süd","Mittelland méridional","G_mehrereParteien;LL_einePartei;Sitzverteilung;Sitzverteilung_Zusatz_alle_Sitze_weg;Neu_gewaehlt_mehrere;Abgewaehlt_1Person;","Im Wahlkreis Mittelland-Süd gibt es mehrere Gewinner: die <b>EVP</b> holt zwei Sitze, die <b>GLP</b> holt zwei Sitze und die <b>SP</b> holt einen Sitz.<br><br>Die <b>SVP</b> ist die grosse Verliererin. Sie büsst drei Sitze ein.<br><br>Neu hält die SP sechs Sitze, die GLP vier Sitze, die EVP drei Sitze, die Grünen zwei Sitze, die Mitte zwei Sitze, die SVP zwei Sitze und die EDU einen Sitz.<br><br>Die FDP hält keine Sitze mehr.<br><br>In diesem Wahlkreis neu gewählt wurden Bauer Tanja (EVP) und Eichenberger Beatrice (GLP).<br><br>Abgewählt ist Burren Andreas (SP).","Plusieurs partis sont vainqueurs dans l'arrondissement de Mittelland méridional: le <b>PEV</b> obtient deux sièges, les <b>Vert'libéraux</b> obtient deux sièges et le <b>PS</b> obtient un siège<br><br><b>L'UDC</b> est le grand battu. Il perd trois sièges.<br><br>Le PS détient désormais six sièges, les Vert'libéraux quatre sièges, le PEV trois sièges, les Verts deux sièges, le Centre deux sièges, l'UDC deux sièges et le UDF un siège.<br><br>Le PLR a perdu tous ses sièges.<br><br>Bauer Tanja (PEV) et Eichenberger Beatrice (Vert'libéraux) siégeront pour la première fois au Grand Conseil.<br><br>Les électeurs ont montré la porte à Burren Andreas (PS)",7
"Thun","Thoune","GG_einePartei;L_mehrereParteien;Sitzverteilung;Sitzverteilung_Zusatz_alle_Sitze_weg_mehrere;Neu_gewaehlt_1Person;","Die <b>Grünen</b> sind im Wahlkreis Thun die grossen Gewinner. Sie holen vier zusätzliche Sitze.<br><br>Es gibt mehrere Verlierer: die <b>FDP</b> verliert zwei Sitze, die <b>SP</b> verliert zwei Sitze, die <b>Mitte</b> verliert einen Sitz und die <b>SVP</b> verliert einen Sitz.<br><br>Neu halten die Grünen fünf Sitze, die SVP vier Sitze, die EVP drei Sitze, die EDU zwei Sitze, die SP zwei Sitze und die GLP einen Sitz.<br><br>Die Mitte und die FDP halten keine Sitze mehr.<br><br>In diesem Wahlkreis neu gewählt wurde Dütschler Peter (EVP).","Les <b>Verts</b> sont le grand gagnants de l'arrondissement Thoune. Il remportertent quatre sièges supplémentaires.<br><br>Les résultats sont mauvais pour le <b>PLR</b> perd deux sièges, le <b>PS</b> perd deux sièges, le <b>Centre</b> perd un siège et <b>l'UDC</b> perd un siège.<br><br>Les Verts détient désormais cinq sièges, l'UDC quatre sièges, le PEV trois sièges, le UDF deux sièges, le PS deux sièges et les Vert'libéraux un siège.<br><br>Le Centre et le PLR ont perdu tous les leurs sièges.<br><br>Dütschler Peter (PEV) siégera pour la première fois au Grand Conseil.",8
"Oberland","Oberland","G_einePartei_1Sitz;L_einePartei_1Sitz;Sitzverteilung;Sitzverteilung_Zusatz_Diverse_1Sitz;Neu_gewaehlt_mehrere;","Die <b>EVP</b> ist im Wahlkreis Oberland die Gewinnerin. Sie holt einen zusätzlichen Sitz.<br><br>Die <b>SP</b> ist die Verliererin. Sie büsst einen Sitz ein.<br><br>Neu hält die SVP sieben Sitze, die EVP zwei Sitze, die FDP zwei Sitze, die EDU einen Sitz, die GLP einen Sitz, die Mitte einen Sitz und die SP einen Sitz.<br><br>Für eine Überraschung sorgt die Liste Parteilose, die einen Sitz erobern kann.<br><br>In diesem Wahlkreis neu gewählt wurden Josi Barbara (SVP), Zimmermann Kurt (SVP), Wandfluh Ernst (SVP), Michel Andreas (SVP) und Abplanalp Ueli (SVP).","Le <b>PEV</b> termine premier dans l'arrondissement Oberland. Il gagne un siège supplémentaire.<br><br>Le <b>PS</b> perd un siège.<br><br>L'UDC détient désormais sept sièges, le PEV deux sièges, le PLR deux sièges, le UDF un siège, les Vert'libéraux un siège, le Centre un siège et le PS un siège.<br><br>Un tout petit parti issu des Parteilose parvient à faire élire un candidat.<br><br>Josi Barbara (UDC), Zimmermann Kurt (UDC), Wandfluh Ernst (UDC), Michel Andreas (UDC) et Abplanalp Ueli (UDC) siégeront pour la première fois au Grand Conseil.",9
